text_id,title,date,period,genre,register,source_edition,source_url,authorship_confidence,editorial_status,inclusion_rationale,risk_flags,corpus_layer,rights_status,git_tracking,expected_local_path,known_limitations
lincoln-lyceum-address,"Address Before the Young Men's Lyceum of Springfield, Illinois",1838-01-27,early-republican-rhetoric,public address,public-address,"Project Gutenberg EBook #3253, extracted from The Papers and Writings of Abraham Lincoln, Complete, Constitutional Edition, ed. Arthur Brooks Lapsley",https://www.gutenberg.org/cache/epub/3253/pg3253.txt,1.0,"public-domain transcription with Gutenberg header/footer stripped; Lapsley date error retained in body but corrected in metadata","Early benchmark for Lincoln on political institutions, inherited republican obligation, law, mob violence, and the transition from revolutionary memory to civic reverence.",source-date-error-in-body,balanced-core,public-domain,committed,cases/lincoln/corpus/raw/lincoln-src-01-lyceum-address.txt,"Gutenberg/Lapsley transcription is adequate for pilot annotation but should be cross-checked against Basler before publication-level quotation."
lincoln-first-inaugural,"First Inaugural Address",1861-03-04,secession-crisis,inaugural address,inaugural-address,"Project Gutenberg EBook #9, standalone First Inaugural transcription",https://www.gutenberg.org/ebooks/9,1.0,"public-domain transcription with Gutenberg header/footer stripped","Adds immediate secession-crisis evidence for Union, constitutional oath, force limits, federal property, minority rule, and sacred civic bonds before battlefield sacrifice.",source-edition-verification,balanced-core,public-domain,committed,cases/lincoln/corpus/raw/lincoln-src-04-first-inaugural.txt,"Public-domain transcription is adequate for draft annotation; exact wording should be cross-checked against LOC or Collected Works before publication-level quotation."
lincoln-special-message-1861-07-04,"Message to Congress in Special Session, July 4, 1861",1861-07-04,secession-crisis,presidential message,presidential message,"Project Gutenberg EBook #2657, extracted from The Papers and Writings of Abraham Lincoln, Volume 5",https://www.gutenberg.org/ebooks/2657,1.0,"public-domain transcription with Gutenberg header/footer stripped and unrelated volume content omitted","Adds war-authorization and democracy-as-experiment evidence: rebellion, constitutional crisis, Union continuity, sacrifice, and early-war public justification.","long-document;source-edition-verification",extended-corpus,public-domain,committed,cases/lincoln/corpus/raw/lincoln-src-05-special-message-1861-07-04.txt,"Long presidential message increases annotation burden; exact wording should be cross-checked against LOC or Collected Works before publication-level quotation."
lincoln-gettysburg-address,"Address Delivered at the Dedication of the Cemetery at Gettysburg",1863-11-19,emancipation-and-sacrifice,ceremonial address,ceremonial-address,"Project Gutenberg EBook #4, Bliss copy transcription",https://www.gutenberg.org/cache/epub/4/pg4.txt,1.0,"public-domain Bliss copy transcription with Gutenberg header/footer stripped","Canonical sacrificial-economy text for battlefield death, national survival, dedication, consecration, unfinished work, and new birth of freedom.","multiple-manuscript-versions-exist;gutenberg-ellipsis-style",balanced-core,public-domain,committed,cases/lincoln/corpus/raw/lincoln-src-02-gettysburg-address.txt,"The Bliss copy is used for pilot consistency; variant manuscript wording should be checked before claims depend on exact phrasing."
lincoln-second-inaugural,Second Inaugural Address,1865-03-04,providence-and-reconciliation,inaugural address,inaugural-address,"Project Gutenberg EBook #8, Abraham Lincoln's Second Inaugural Address",https://www.gutenberg.org/cache/epub/8/pg8.txt,1.0,"public-domain transcription with Gutenberg header/footer stripped","Central final-war text for Providence, oath, Union, shared guilt, blood repayment, judgment, reconciliation, and healing language.",,balanced-core,public-domain,committed,cases/lincoln/corpus/raw/lincoln-src-03-second-inaugural.txt,"Reliable for pilot annotation; manuscript cross-check remains required before publication-level quotation."
